Microsoft Windows XP [版本 5.1.2600]
(C) 版权所有 1985-2001 Microsoft Corp.

C:\Documents and Settings\user>sqlplus sysman/dashi

SQL*Plus: Release 10.2.0.1.0 - Production on 星期三 3月 28 18:41:10 2007

Copyright (c) 1982, 2005, Oracle.  All rights reserved.


连接到:
Oracle Database 10g Enterprise Edition Release 10.2.0.1.0 - Production
With the Partitioning, OLAP and Data Mining options

SQL> drop table e;

表已删除。

SQL> select * from d;

EID        ENAME      SEX        ID
---------- ---------- ---------- ----------
001        赵1        男         01
002        钱2        男         02
003        孙3        男         32233
004        李4        女         04
005        周5        女         55
121        sdkjfls               77
121        sdkjfls               22
0111       abc        man        22
001        test22
01         A部门
02         B部门

EID        ENAME      SEX        ID
---------- ---------- ---------- ----------
03         C部门
04         D部门
05         E部门

已选择14行。

SQL> select * from c;

BOOKS_ID   BOOKS_NAME PRICE             QTY PUB
---------- ---------- ---------- ---------- ----------
0001       中国文学   39                 12 人民文学
0002       外国文学   27                 10 人民文学
0003       英语阅读   33                 22 清华大学
0004       建筑艺术   45.5               17 清华大学
0005       计算机入门 18.5               88 电子工业
0006       数值算法   21                  7 电子工业
0007       C语言设计  20                  9 电子工业
0013       akdsl      22                  3 eed
0032       kdsj       35                 21 ksd
0008

已选择10行。

SQL> rallback;
SP2-0042: 未知命令 "rallback" - 其余行忽略。
SQL> rollback
  2  ;

回退已完成。

SQL> select * from e;
select * from e
              *
第 1 行出现错误:
ORA-00942: 表或视图不存在


SQL> create table e(id varchar2(10),name varchar2(10));

表已创建。

SQL> insert into e values('01','A部门
  2  ');

已创建 1 行。

SQL> insert into e values('02','B部门');

已创建 1 行。

SQL> insert into e values('03','C部门');

已创建 1 行。

SQL> insert into e values('04','D部门') ;

已创建 1 行。

SQL> insert into e values('05','E部门');

已创建 1 行。

SQL> select * from e;

ID         NAME
---------- ----------
01         A部门
02         B部门
03         C部门
04         D部门
05         E部门

SQL> select * from d;

EID        ENAME      SEX        ID
---------- ---------- ---------- ----------
001        赵1        男         01
002        钱2        男         02
003        孙3        男         32233
004        李4        女         04
005        周5        女         55
121        sdkjfls               77
121        sdkjfls               22
0111       abc        man        22
001        test22
01         A部门
02         B部门

EID        ENAME      SEX        ID
---------- ---------- ---------- ----------
03         C部门
04         D部门
05         E部门

已选择14行。

SQL> delete from d where eid=121,0111,01,02,03,04,05;
delete from d where eid=121,0111,01,02,03,04,05
                           *
第 1 行出现错误:
ORA-00933: SQL 命令未正确结束


SQL>  delete from d where eid=121,0111;
 delete from d where eid=121,0111
                            *
第 1 行出现错误:
ORA-00933: SQL 命令未正确结束


SQL>  delete from d where eid=121,eid=0111;
 delete from d where eid=121,eid=0111
                            *
第 1 行出现错误:
ORA-00933: SQL 命令未正确结束


SQL> select eid 编者按, ename 名, sex 性别,e.name 所在部门 from d,e where e.id=d.id;

编者按     名         性别       所在部门
---------- ---------- ---------- ----------
001        赵1        男         A部门
002        钱2        男         B部门
004        李4        女         D部门

SQL> select eid 纺者,ename dk,sex kdj,e.name kdj from d join e where e.id=d.id;
select eid 纺者,ename dk,sex kdj,e.name kdj from d join e where e.id=d.id
                                                          *
第 1 行出现错误:
ORA-00905: 缺失关键字


SQL> select eid ljsd,ename kd,sex kd,e.name dkj from d join e on e.id=d.id;

LJSD       KD         KD         DKJ
---------- ---------- ---------- ----------
001        赵1        男         A部门
002        钱2        男         B部门
004        李4        女         D部门

SQL> update d set id='55' where eid='
  2  05';

已更新0行。

SQL> select * from d;

EID        ENAME      SEX        ID
---------- ---------- ---------- ----------
001        赵1        男         01
002        钱2        男         02
003        孙3        男         32233
004        李4        女         04
005        周5        女         55
121        sdkjfls               77
121        sdkjfls               22
0111       abc        man        22
001        test22
01         A部门
02         B部门

EID        ENAME      SEX        ID
---------- ---------- ---------- ----------
03         C部门
04         D部门
05         E部门

已选择14行。

SQL> update d set d.id='55' where eid='005';

已更新 1 行。

SQL> select * from e where id in(select id from d);

ID         NAME
---------- ----------
01         A部门
02         B部门
04         D部门

SQL> select * from e where id in(select id from d);

ID         NAME
---------- ----------
01         A部门
02         B部门
04         D部门

SQL> select * from d where id in(select id from e where e.id=d.id and e.id='03');

未选定行

SQL> select * from d;

EID        ENAME      SEX        ID
---------- ---------- ---------- ----------
001        赵1        男         01
002        钱2        男         02
003        孙3        男         32233
004        李4        女         04
005        周5        女         55
121        sdkjfls               77
121        sdkjfls               22
0111       abc        man        22
001        test22
01         A部门
02         B部门

EID        ENAME      SEX        ID
---------- ---------- ---------- ----------
03         C部门
04         D部门
05         E部门

已选择14行。

SQL> select * from d where eid='004' or eid='005' or eid='003';

EID        ENAME      SEX        ID
---------- ---------- ---------- ----------
003        孙3        男         32233
004        李4        女         04
005        周5        女         55

SQL> select * from d where exists (select id from e);

EID        ENAME      SEX        ID
---------- ---------- ---------- ----------
001        赵1        男         01
002        钱2        男         02
003        孙3        男         32233
004        李4        女         04
005        周5        女         55
121        sdkjfls               77
121        sdkjfls               22
0111       abc        man        22
001        test22
01         A部门
02         B部门

EID        ENAME      SEX        ID
---------- ---------- ---------- ----------
03         C部门
04         D部门
05         E部门

已选择14行。

SQL> select * from e;

ID         NAME
---------- ----------
01         A部门
02         B部门
03         C部门
04         D部门
05         E部门

SQL> select * from d where exists(select id from d where eid='04');

EID        ENAME      SEX        ID
---------- ---------- ---------- ----------
001        赵1        男         01
002        钱2        男         02
003        孙3        男         32233
004        李4        女         04
005        周5        女         55
121        sdkjfls               77
121        sdkjfls               22
0111       abc        man        22
001        test22
01         A部门
02         B部门

EID        ENAME      SEX        ID
---------- ---------- ---------- ----------
03         C部门
04         D部门
05         E部门

已选择14行。

SQL> select * from d where exists(select dfsd from e);
select * from d where exists(select dfsd from e)
                                    *
第 1 行出现错误:
ORA-00904: "DFSD": 标识符无效


SQL> select * from d where exists(select books_id from c);

EID        ENAME      SEX        ID
---------- ---------- ---------- ----------
001        赵1        男         01
002        钱2        男         02
003        孙3        男         32233
004        李4        女         04
005        周5        女         55
121        sdkjfls               77
121        sdkjfls               22
0111       abc        man        22
001        test22
01         A部门
02         B部门

EID        ENAME      SEX        ID
---------- ---------- ---------- ----------
03         C部门
04         D部门
05         E部门

已选择14行。

SQL> select * from d where exists (select id from d where d.id=e.id);
select * from d where exists (select id from d where d.id=e.id)
                                                          *
第 1 行出现错误:
ORA-00904: "E"."ID": 标识符无效


SQL> select * from d where exists(select id from d where d.id=e.id);
select * from d where exists(select id from d where d.id=e.id)
                                                         *
第 1 行出现错误:
ORA-00904: "E"."ID": 标识符无效


SQL> select * from d where d.id=e.id;
select * from d where d.id=e.id
                           *
第 1 行出现错误:
ORA-00904: "E"."ID": 标识符无效


SQL> select * from e;

ID         NAME
---------- ----------
01         A部门
02         B部门
03         C部门
04         D部门
05         E部门

SQL> select * from e;

ID         NAME
---------- ----------
01         A部门
02         B部门
03         C部门
04         D部门
05         E部门

SQL> select * from d where exists(select * from d,e where e.id=d.id);

EID        ENAME      SEX        ID
---------- ---------- ---------- ----------
001        赵1        男         01
002        钱2        男         02
003        孙3        男         32233
004        李4        女         04
005        周5        女         55
121        sdkjfls               77
121        sdkjfls               22
0111       abc        man        22
001        test22
01         A部门
02         B部门

EID        ENAME      SEX        ID
---------- ---------- ---------- ----------
03         C部门
04         D部门
05         E部门

已选择14行。

SQL> select eid from d union select id,name from e;
select eid from d union select id,name from e
*
第 1 行出现错误:
ORA-01789: 查询块具有不正确的结果列数


SQL> select eid from d union select id,name from e;
select eid from d union select id,name from e
*
第 1 行出现错误:
ORA-01789: 查询块具有不正确的结果列数


SQL> select eid,ename from d
  2  union
  3  select id,name from e;

EID        ENAME
---------- ----------
001        test22
001        赵1
002        钱2
003        孙3
004        李4
005        周5
01         A部门
01         A部门
0111       abc
02         B部门
03         C部门

EID        ENAME
---------- ----------
04         D部门
05         E部门
121        sdkjfls

已选择14行。

SQL> select id from d
  2  union
  3  select id from e;

ID
----------
01
02
03
04
05
22
32233
55
77


已选择10行。

SQL> select I from d;
select I from d
       *
第 1 行出现错误:
ORA-00904: "I": 标识符无效


SQL> create table ttt as (select * from d0;
create table ttt as (select * from d0
                                    *
第 1 行出现错误:
ORA-00907: 缺失右括号


SQL> create table ttt as (select * from d);l
  2  ;
create table ttt as (select * from d);l
                                     *
第 1 行出现错误:
ORA-00911: 无效字符


SQL> create table ttt as (select * from d);
create table ttt as (select * from d)
             *
第 1 行出现错误:
ORA-00955: 名称已由现有对象使用


SQL> drop table ttt;

表已删除。

SQL> cteate table ttt as (select id from d);
SP2-0734: 未知的命令开头 "cteate tab..." - 忽略了剩余的行。
SQL> create table ttt as (select id from d);

表已创建。

SQL> select * from ttt;

ID
----------
01
02
32233
04
55
77
22
22




ID
----------




已选择14行。

SQL> drop ttt;
drop ttt
     *
第 1 行出现错误:
ORA-00950: 无效 DROP 选项


SQL> drop table ttt;

表已删除。

SQL> create table t as select eid,ename from d where e.eid='003';
create table t as select eid,ename from d where e.eid='003'
                                                *
第 1 行出现错误:
ORA-00904: "E"."EID": 标识符无效


SQL> create table t as select eid from d where d.eid='003';
create table t as select eid from d where d.eid='003'
             *
第 1 行出现错误:
ORA-00955: 名称已由现有对象使用


SQL> drop table t;

表已删除。

SQL> create table t as select * from d where d.eid='003' or d.eid='005';

表已创建。

SQL> select * from t;

EID        ENAME      SEX        ID
---------- ---------- ---------- ----------
003        孙3        男         32233
005        周5        女         55

SQL>